{
  "kind": "planning-issue-relation/v1",
  "external_ref": "2664",
  "lane_id": "repo-evolution-self-maintenance",
  "priority": "P1",
  "depends_on": [
    "2662"
  ],
  "rationale": "Positive coverage acquisition builds on #2662.",
  "maturity": "ready-to-promote",
  "shaping_revision": 2,
  "created_at": "2026-08-22T20:32:25.527504Z",
  "updated_at": "2026-08-22T20:37:20.088935Z",
  "authority": {
    "membership": "this-record",
    "priority": "this-record",
    "dependencies": "this-record",
    "rationale": "this-record",
    "maturity": "this-record",
    "execution_lifecycle": "derived-not-owned"
  },
  "relation_revision": "52a5f5dda1e22410"
}
