{
  "kind": "planning-issue-relation/v1",
  "external_ref": "2198",
  "lane_id": "ungrouped",
  "priority": "P2",
  "depends_on": [],
  "rationale": "Open upstream issue from refreshed external intent evidence; priority P2 inferred from inferred-slice.",
  "maturity": "ready-to-promote",
  "shaping_revision": 1,
  "created_at": "2026-08-28T15:27:47.806833Z",
  "updated_at": "2026-08-28T15:27:47.806833Z",
  "authority": {
    "membership": "this-record",
    "priority": "this-record",
    "dependencies": "this-record",
    "rationale": "this-record",
    "maturity": "this-record",
    "execution_lifecycle": "derived-not-owned"
  },
  "relation_revision": "721e81598f734612"
}
